<?xml version="1.0" encoding="UTF-8"?>
<xs:schema xmlns:xs="http://www.w3.org/2001/XMLSchema" elementFormDefault="qualified">
    <xs:element name="arancel">
        <xs:complexType>
            <xs:sequence>
                <xs:element name="tipo" type="xs:string"/>
                <xs:element name="valor" type="xs:decimal"/>
            </xs:sequence>
        </xs:complexType>
    </xs:element>
    <xs:element name="pais">
        <xs:complexType>
            <xs:sequence>
                <xs:element name="nombre" type="xs:string"/>
                <xs:element name="arancel" maxOccurs="1" minOccurs="1">
                    <xs:complexType>
                        <xs:sequence>
                            <xs:element name="tipo" type="xs:string"/>
                            <xs:element name="valor" type="xs:decimal"/>
                        </xs:sequence>
                    </xs:complexType>
                </xs:element>
            </xs:sequence>
        </xs:complexType>
    </xs:element>
    <xs:element name="aranceles">
        <xs:complexType>
            <xs:sequence>
                <xs:element name="pais" maxOccurs="unbounded">
                    <xs:complexType>
                        <xs:sequence>
                            <xs:element name="nombre" type="xs:string"/>
                            <xs:element name="arancel" maxOccurs="1">
                                <xs:complexType>
                                    <xs:sequence>
                                        <xs:element name="tipo" type="xs:string"/>
                                        <xs:element name="valor" type="xs:decimal"/>
                                    </xs:sequence>
                                </xs:complexType>
                            </xs:element>
                        </xs:sequence>
                    </xs:complexType>
                </xs:element>
            </xs:sequence>
        </xs:complexType>
    </xs:element>
</xs:schema>